Cigarettes After Sex,Cry,"<a class=""genre-list__link"" href=""/reviews/albums/?genre=experimental"">Experimental</a>","It feels almost like a novelty these days for a dude to write an album entirely about being extremely horny. Men don’t make music about sex the way they used to. We are far past the epoch of Serge Gainsbourg writing pop songs that involved Jane Birkin or Brigitte Bardot mimicking the sounds of orgasm. People have more or less collectively agreed that rendering women as pure sex objects in music doesn’t need to happen so much anymore. Greg Gonzalez, the frontman of the noir dream-pop band Cigarettes After Sex, must not have gotten the memo. He operates within a space of midcentury sexual anachronism. His second record, Cry, is a 41-minute dream about Penthouse pets and women in silken underthings, filtered through chiaroscuro and top-shelf whiskey. There is a universe where this raciness could conceivably offer a reprieve from indie rock’s occasional prudishness. Unfortunately, Gonzalez’s candor about his desire comes off as lifeless and borderline asinine.This is clear from the first play of the record. The bleak textures, like those of the band’s debut, have been airlifted from the darkest corners of dream-pop music. There are notes of Violet Indiana and the Verve circa A Storm in Heaven, as well as more obvious tips of the hat to Angelo Badalamenti and David Lynch. “Kiss It Off Me,” the album’s second song, uses subterranean synth parts that are uncannily similar to the ones on the Twin Peaks soundtrack. The intrigue and Lynchian darkness pretty much stop once we meet the apple of Gonzalez’s eye, a protagonist as two-dimensional as a piece of paper peeling off a picnic table in a light breeze. “I could see you were walking slow/Drinking a Slurpee/In a peach baseball cap/Falling in my lap/You were so thirsty,” Gonzalez sings, with unearned wistfulness. He yearns to make her forget about “all of those rich fuckboys” she tends to date, and by the end of the song, she’s biting her lip and begging for it before she heads off to the gym in the morning. If there is anything romantic about this encounter, it is washed away by the song’s utter inability to deviate from overused ’90s pastiche—or, more importantly, to represent the woman in question as anything other than some chick who loves to work out and have sex.Then there’s “Hentai,” a song that’s literally about anime porn. Specifically, about a hentai video he described to his paramour the first time they “made love,” about “a girl who as soon as she made you come/Could show you the future and tell you your fortune.” The scene setting could almost be funny, but there’s scant irony in Gonzalez’s delivery. The sound of the song is as delicate as an antique plate gathering dust on a shelf: High notes on electric guitars are languidly plucked, and the bassline is a slow IV drip that gives you goosebumps. Then there’s the question of Gonzalez’s voice, a truly lovely and androgynous tenor that’s wasted on lines like these. You could lose yourself in the sound, if losing yourself is akin to collapsing on an overly plush bed. “Pure” is an equally banal and pornographic sketch of a song. Here, Gonzalez’s woman wears a white bodysuit and has wet hair.  Long story short, she goes down on him, and then they go stare out the window but all he can think about is how he got to see her naked. It’s the album’s closer, but it’s likely to leave you feeling nothing, other than perhaps blunted anger.Cry doesn’t evoke much in the name of passion. Unless, of course, passion is the same thing as wafting through depression, and sex is the means to fill that void. There is nothing wry about the way Gonzalez writes about sex. The album has almost zero sense of humor and is deadly serious in its execution. It’s important to write about sex on one’s own terms, and there are plenty of compelling ways to explore sexuality in song. The problem here is that the narrative of this record is essentially one giant, dull, and gross fantasy plucked from adolescent male puberty. It presents a vision of sex that comes from surfing Pornhub after school before your parents get home from work, and from looking at pictures of minimally clad Instagram influencers while waiting in line to get a flu shot. Gonzalez’s attempt to be honest about his experiences is far removed from the reality of what it is like to be sexually vulnerable in front of another person. Cry is a soulless and Styrofoam record as hollow as a booty-call text at 3 a.m. “Hey sexy, you up?” the record seems to beckon. It’s hardly an inviting proposition.Buy: Rough Trade(Pitchfork may earn a commission from purchases made through affiliate links on our site.)","[Verse 1]
When I was young, I thought the world of you
You were all that I wanted then
It faded and I never saw you again
But I won’t forget the love we had

[Chorus]
Come to me now
Don’t let me go
Stay by my side
Don’t let me go
Stay with me still
I’ve missed you so

[Verse 2]
When I was young, I thought the world of you
I was dumb to let you drift away
And though I guess it had to come to an end
No one else could have the love we shared

[Chorus]
Come to me now
Don’t let me go
Stay by my side
And my heart goes
Out to you
Wherever you are

[Instrumental Bridge]

[Chorus]
Come to me now
Don’t let me go
Stay by my side
Don’t let me go
Stay with me still
I’ve missed you so[Verse 1]
Saw you on the side of the road
I could see you walkin' slow
Drinkin' a Slurpee
In a peach baseball cap
Fallin' in my lap
You were so thirsty

[Pre-Chorus]
Could you love me instead
Of all the boyfriends you got?
Know I make you forget
About all of those rich fuckboys

[Chorus]
Kiss it off me
If you're gonna break my heart
This is a good start
Kiss it off me

[Verse 2]
You always bite your lip
When you're feelin' it
As we move slowly
And your peach baseball cap
Is tossed under the rack
Of clothes and your jewelry

[Pre-Chorus]
And you're back for it
In the morning again
Before you go to the gym
Said ""It's a bad time"" but you just can't quit

[Chorus]
Kiss it off me
If you're gonna break my heart
This is a good start
Kiss it off me

[Bridge]

[Chorus]
Kiss it off me
If you're gonna break my heart
This is a good start
Kiss it off me
If you're gonna break my heart
This is a good start
Kiss it off me[Verse 1]
Wanting your love to come into me
Feeling it slow, over this dream
Touch me with a kiss
Touch me with a kiss
Now you're above feeling it still
Tell me it's love, tell me it's real
Touch me with a kiss, feel me on your lips

[Chorus]
'Cause this is where
I wanna be
Where it's so sweet
And heavenly
I'm giving you all my, giving you all my
Giving you all my love
Giving you all my, giving you all my
Giving you all my love
All my love

[Verse 2]
Needing you now to come into me
Feeling it slow, over this dream
Touch me with a kiss
Feel me on your lips
When you're above feeling it still
Tell me it's love, tell me it's real
Touch me with a kiss, touch me with a kiss

[Chorus]
'Cause this is where
I wanna be
Where it's so sweet
And heavenly
I'm giving you all my, giving you all my
Giving you all my love
Giving you all my, giving you all my
Giving you all my love
All my love

[Bridge]
And when you're far away
I still feel it all
And when you're far away
I still feel it all the same
And when you're far away, far away

[Instrumental]

[Outro]
I'm giving you all my, giving you all my
Giving you all my love
Giving you all my, giving you all my
Giving you all my love[Verse 1]
You only fuck for love
Told me you could never get enough
Posing as a Playboy centerfold
You could be my Penthouse Pet, I know

[Chorus]
You make me think of
Storms on the beaches
With all the lights off
Everything is wrong but it's all right
Everything is wrong but it's all right
You're the only good thing in my life

[Verse 2]
Do what your heart desires
Love is always strange when it just starts
Shouldn't have a care left in the world
Naked, tanning by the swimming pool

[Chorus]
You make me think of
Storms on the beaches
With all the lights off
Everything is wrong but it's all right
Everything is wrong but it's all right
You're the only good thing in my life

[Outro]
Layin' in the sun
Never need to tell me when you come
'Cause you know that I can just feel it[Verse 1]
Oh, I missed you and I cried
But I said that I was alright
And I know it's been a while
Since I needed a distraction

[Pre-Chorus]
’Cause I wanna do everything
That you want me to, to tell you the truth
I need to stay alive
So sad that I could die

[Chorus]
It's leading me on, every time we touch
Leading me on, every time it hurts
Feeling so lonely, 'cause it’s not enough
Missin' you only, ever since we fell in love

[Verse 2]
And I watched you do a line
That you spread out on the table
I don't need to say a word
I just wanna see you upside down

[Pre-Chorus]
I wanna do everything
That you want me to, to tell you the truth
I listen to you cry all night
Through the telephone

[Chorus]
It's leading me on, every time we touch
Leading me on, every time it hurts
Feeling so lonely, 'cause it's not enough
Missin' you only, ever since we fell in love

[Verse 3]
Couldn't say you didn’t want me there
When we were lyin’ in my bed that night
You were acting like a different person
As if, suddenly, you wanted to just be friends
I was hurting so I took a shower
So you couldn't hear me, knowing I had to cry
Sad to know that while my heart was breaking
You were sleeping normal, just vacant

[Chorus]
It’s leading me on, every time we touch
Leading me on, every time it hurts
Feeling so lonely, 'cause it's not enough
Missin' you only, ever since we fell in love[Verse 1]
There was a hentai video that I saw
I told you about the night that we first made love
About a girl who as soon as she made you cum
Would show you the future and tell you your fortune

[Chorus]
Beautiful hearts are in your eyes
I've been waiting for you to fall for me
And let me in your life
I've been waiting for you

[Verse 2]
Told you I wanted to die in an airplane crash
Over the ocean, thought it was romantic
But you didn't like it, thought it was stupid, ah
Thinking of me dead is making you feel bad

[Chorus]
Beautiful hearts are in your eyes
I've been waiting for you to fall for me
And let me in your life
I've been waiting for you

[Instrumental Break]

[Chorus]
Beautiful hearts are in your eyes
I've been waiting for you to fall for me
And let me in your life
I've been waiting for you[Verse 1]
It's making you cry every time
You give your love to me this way
Saying you'd wait for me to stay
I know it hurts you

[Chorus]
But I need to tell you something
My heart just can't be faithful for long
I swear I'll only make you cry

[Verse 2]
Maybe I'd change for you someday
But I can't help the way I feel
Wish I was good
Wish that I could give you my love now

[Chorus]
But I need to tell you something
My heart just can't be faithful for long
I swear I'll only make you cry

[Instrumental Break]

[Chorus]
I need to tell you something
My heart just can't be faithful for long
I swear I'll only make you cry[Verse 1]
When I hold you close to me
I could always see a house by the ocean
Last night I could hear the waves
As I heard you say, ""All that I want is to be yours""

[Chorus]
Falling in love
Falling in love
Deeper than I've felt it before
With you, baby
I feel I'm falling in love with all my heart

[Verse 2]
Back when you were far away
We would go on dates to watch the same movie
And you were imagining sitting next to me
Holding my hand for the whole thing

[Chorus]
Falling in love
Falling in love
Deeper than I've felt it before
With you, baby
I feel I'm falling in love with all my heart

[Instrumental Break]

[Chorus]
Falling in love
Falling in love
Deeper than I've felt it before
With you, baby
I feel I'm falling in love with all my heart[Verse 1]
When you walk in the room
In a white bodysuit
And I say, ""Take it off""
Say it slow, me to watch

[Chorus]
Man, it's pure
Only your love could get me to fall
Burn as deep, get so hot
And it's so beautiful

[Verse 2]
And the TV is on
When we make love because
We get carried away
We don't care anyway

[Chorus]
Man, it's pure
Only your love could get me to fall
Burn as deep, get so hot
And it's so beautiful

[Verse 3]
Wrapped your head in a towel
But I watch you let it down
And it's all soaking wet
As you take me in your mouth
And we stare at the street
From the back balcony
But now all I can see
Is you undressing for me

[Chorus]
Man, it's pure
Only your love could get me to fall
Burn as deep, get so hot
And it's so beautiful",2019-10-28,4.0
Ali Barter,"Hello, I’m Doing My Best","<a class=""genre-list__link"" href=""/reviews/albums/?genre=pop"">Pop/R&amp;B</a>","Though happily married and sober, Melbourne songwriter and guitarist Ali Barter wouldn’t dare write about anything so peaceful. Barter’s muse is the thrilling turbulence of young adulthood, and the lasting resonance of the bad decisions one makes in their early 20s. On her new record Hello, I’m Doing My Best, these themes coalesce with the confidence and immediacy of 2000s pop-rock. The result is an emotionally nuanced album that never takes itself too seriously.Barter’s debut, 2017’s A Suitable Girl, was a lovably slapdash collection of, in the words of one beloved teen film, “angry girl music of the indie-rock persuasion”—feminist pop-rock that angled for everywoman relatability. That formula worked well for Barter, with the singles “Girlie Bits” and “Cigarette” achieving modest success in her home country. Many of the songs on A Suitable Girl, though, suffered from a certain anonymity. Her bid for universality resulted in lines like “What’s a woman made of?/Something glorious”—well-intentioned but nevertheless a little hackneyed.Hello, I’m Doing My Best makes no such attempts, instead leaning full-tilt into Barter’s loose-cannon instincts. She draws herself as an indie rock Fleabag, a self-deprecating and hard-drinking flirt who texts her crushes at 3 a.m. and listens to “Malibu” to get through the hangover the next morning. From its earliest moments—the Hole reference comes in the very first line—Hello, I’m Doing My Best is appealingly frank. “Ur a Piece of Shit,” the second track, is a bombastic love letter to a friend in crisis: “You got your daddy issues,” Barter sings. “It made you real suspicious/That’s why you hacked in his account.” She wastes no time with poetics, and while it’s a risky move—she ends up rhyming “drugs” with “drugs”—it displays a kind of gonzo commitment to the album’s messy, diaristic heart.With loud and unadorned production, Hello, I’m Doing My Best taps into a current of emotive, candid pop-rock typified by the Josie and the Pussycats soundtrack and currently practiced by the likes of Charly Bliss and Bully. There’s not an ounce of crunch or grit here, just clean, sanded-down edges and lacquered finishes. The production—handled by Barter’s husband, Oscar Dawson of the band Holy Holy—adds an early-2000s patina, giving the record the pleasing accessibility of teen classics like Avril Lavigne’s Let Go.Hello, I’m Doing My Best often reads as a guidebook for young adults learning to navigate the world, and in that light, Barter’s no-bullshit lyricism is punkish and endearing. On “Ur a Piece of Shit,” for example, she gleefully calls on listeners to “put your hands up” for various messed-up teenage experiences, like “eating disorders,” “if a doctor touched you,” and “if it felt good to cut yourself.” In moments like these, Barter resembles a young Liz Phair, writing with a shamelessness that few songwriters since have really relished. Lines like, “I heard you like Tool, yeah/And you got really cool hair/And I think that you should be my boyfriend” feel directly indebted to Phair, and the chorus of “History of Boys” (“I used to get drunk and blackout/I used to get drunk and tell you I need you”), while hewing closer to pop than anything Phair wrote in her early days, owes its gutsiness to her.It helps that Barter never lets a linear personal narrative define these songs. The only time she writes about her now-husband, on “Backseat,” she revisits a time before they met, hinting at the future by declaring that “we’d be perrrrrfect” alongside a grandiose Guitar Hero-style solo. “January,” a dejected highlight on an otherwise frenetic album, stops in at one of life’s Sisyphean checkpoints: the hope of magically becoming a better person come New Year’s Day. “I made it through the year again with Diet Coke and cigarettes,” she sings. It could be any year; life, Barter seems to say, runs on a loop, and despite all we think we’ve learned, no amount of personal growth is certain to prevent mistakes. Even hindsight rarely makes everything clear. At least Hello, I’m Doing My Best makes it sound like a blast.Buy: Rough Trade(Pitchfork may earn a commission from purchases made through affiliate links on our site.)",,2019-10-28,7.2
