Jimmy Eat World,Surviving,"<a class=""genre-list__link"" href=""/reviews/albums/?genre=rock"">Rock</a>","Surviving is apt. Formed in 1993, and featuring the same core members since ’95, Jimmy Eat World has enjoyed a course marked by steady output, frequent touring and quiet durability. As luck would have it, they’ve hung on long enough to find themselves releasing their 10th studio album just as emo nostalgia reaches its zenith. Surviving is both occasion for a survey of the beloved Arizona band’s two-decade-plus career and a further push into arena rock; a driving, if not always transportative, selection that should tour favorably.Their latest reunites them with Justin Meldal-Johnsen, the producer for M83 and decades-long live bassist for Beck who worked on their triumphant last album, 2016’s Integrity Blues. On Surviving, the producer guides the band’s instincts towards a heavier sound, letting noise from their guitars and Zach Lind’s drums decay. Meldal-Johnsen addresses lacunae in frontman Jim Adkins’ operative knowledge of synth sounds, as on the U2-evocative “555,” an album outlier which features some Fitz and the Tantrums-like hand-clapping. James King, co-founding member of Fitz, shows up for a saxophone solo on “All The Way (Stay),” just like he did on the Meldal-Johnsen-produced M83 sparkler “Midnight City.” Longtime collaborator and former touring member Rachel Haden, of that dog., contributes backing vocals. The track, which considers staying away from the party rather than at it (“Who really says they hope they’ll meet ‘the one’ for the first time at a bar drinking early?”) is one of the more personal allusions to recovery from addiction that Adkins, sober for six years, ventures here.Lyrically, Surviving is as sincere as their past efforts but less specific. “You’re not alone in pain/Never alone in pain,” Adkins sings on the album’s title track. The band’s shortest LP to date, Surviving moves at a quick clip, losing some of the polish from their last outing with Meldal-Johnsen. They’re conscious when they sound too slick for their own good: The opening acoustic guitar riff on “One Mil” was recorded on Adkins’ iPhone mic in his garage. AFI frontman Davey Havok, who appears on the album finale “Congratulations,” also appears via iPhone.“There’s no clarity in front of me,” Adkins sings on that song, which serves as a sort of curtain call. At six minutes, it somehow still feels a little short. It’s hard to imagine this iteration of J.E.W. recording another “Goodbye Sky Harbor,” that loitering Clarity closer that would take up nearly half of their latest album’s length. By Surviving’s terminus, listeners might find themselves wanting more risks. But the album on the whole is a solid, self-aware addition to Jimmy Eat World’s catalog, and if the band’s modest strivers’ outlook has proved anything, it’s that there will be another. A band whose biggest song is against writing oneself off always has work to do.Buy: Rough Trade(Pitchfork may earn a commission from purchases made through affiliate links on our site.)","[Verse 1]
Don't hide your face
What you were before
Doesn't have to be
You any more
Maybe you've been scared
And that's what you know
And all the shame
Gonna call you home
It's gonna call you home

[Verse 2]
It never was your fault
But still a part you played
You carry it so close
You can read it's name
In a lot of ways
You're still that lost kid
Yeah, you could still survive
But not exactly live
No, not exactly live

[Verse 3]
Gonna stand this cold
Gonna see it out
Never define yourself
What choice is left there to make?
If no one said it yet
It would be a shame
It ends right now
You never wanted the pain
Never wanted the pain

[Outro]
Never wanted the pain
Never wanted the pain
Never wanted the pain[Verse 1]
The ghost of recent misery
Still has a song to sing
You captivated hearts
Waiting for a spark
No one you care to recognize
Suddenly in control
Unfortunate to find
What it is inside

[Chorus]
Criminal energy
If you got blood to bleed
Your fever with the fight
Your each and every night
Oh, yeah, you'll come to see
We're the same, we're the same, yeah, it's understood
We're gonna take, gonna take while the getting's good
Come get it all for free
Criminal energy, criminal energy
Huh

[Verse 2]
Answer any conspiracy
So irresistible
But there's no them to see
Only you and me
No face, no cause for empathy
They tell you all the time
The threat is still alive
Yeah, that's still a lie

[Chorus]
Criminal energy
If you got blood to bleed
Your fever with the fight
Your each and every night
Oh, yeah, you'll come to see
That we're the same, we're the same, yeah, it's understood
We're gonna take, gonna take while the getting's good
Come get it all for free
Criminal energy
Criminal energy
Oh!

[Instrumental Bridge]

[Chorus]
Criminal energy
If you got blood to bleed
Your fever with the fight
Your each and every night
Oh, yeah, you'll come to see
That we're the same, we're the same, yeah, it's understood
We're gonna take, gonna take while the getting's good
Come get it all for free
Criminal energy

[Outro]
Criminal energy
Criminal energy
Criminal energy
Criminal energy[Verse 1]
Well, I know I'm dreaming
But it feels too good to stop
The picture in my head is always moving
We're alone at sunset
There's snowfall in air
It's only special once 'cause there's an ending

[Pre-Chorus]
And we realize we're in a future memory

[Chorus]
I can only use what I learn from you
And the rest I quietly accept and burn through
I can only be so much potentially
From the rest, I patiently request delivery

[Verse 2]
Don't worry where we end up
This ending up's not real
The life we build we never stop creating
So we move to a cliffside
A shoreline nowhere
A freezing drive ahead with every crossing

[Pre-Chorus]
And the things you hope someday will come keep waiting

[Chorus]
I can only use what I learn from you
And the rest I quietly accept and burn through
I can only be so much potentially
From the rest, I patiently request delivery

[Bridge]
Sold on a lie
A lie old as time
You'll search until you die
Only partially the truth
Someone's out there for you
But not everyone's ready to be found
No, you might not be ready to be found

[Chorus]
I can only use what I learned from you
And the rest I quietly accept and burn through
I can only be so much potentially
From the rest, I patiently request delivery
I can only use what I learn from you
And the rest I quietly accept and burn through
I can only be so much potentially
From the rest, I patiently request delivery[Verse 1]
I keep my focus on the simple things
Trying to find some peace along the way
Wish I knew how long I'm supposed to wait
Holding on but just barely

[Pre-Chorus]
Got the feeling I've been talking to a dead, dead line
There's always a reason to let it change
Is there anyone there listening while you cry, cry, cry?
There's always a reason for the pain

[Chorus]
I'm doing the things that I'm told every day, every day, every day
Then why does it feel like I'm moving in place, in place, in place?

[Verse 2]
Never had anything to prove
But never was anyone like you
All you fought through, all you had to face
Made you stronger, unafraid

[Pre-Chorus]
Got the feeling I've been talking to a dead, dead line
There's always a reason to let it change
Is there anyone there listening while you cry, cry, cry?
Always a reason for the pain

[Chorus]
I'm doing the things that I'm told every day, every day, every day
Then why does it feel like I'm moving in place, in place, in place?
I gotta believe that you're there when I sing, when I sing, when I sing
'Cause if you're not real, I'm losing my head, in my head, in my head

[Pre-Chorus]
Got the feeling I've been talking to a dead, dead line
There's always a reason to let it change
Is there anyone there listening while you cry, cry, cry?
Always a reason for the pain

[Chorus]
I'm doing the things I've been told every day, every day, every day
Then why does it feel like I'm moving in place, in place, in place?
I gotta believe that you're there when I sing, when I sing, when I sing
'Cause if you're not real, I'm losing my head, in my head, in my head

[Outro]
I keep my focus on the simple things
Trying to find some peace along the way[Verse 1]
Camera girl, you still there?
If I look you'll disappear
Worse, you might wanna talk
I'm so underprepared
I don't know, is it real?
I can't ignore the way it feels
Like the stomach punch it is

[Chorus]
I try but I can waste one million chances
Before you're gone, before I get your name
Keep dreamin' 'cause I'm the only one awake here
You're always gone, always slip away

[Verse 2]
Can't explain why it sticks
Why I seem to get stuck in
Unsustainable amounts of time reliving this
I wish I had mastery of wit, luck, fearless confidence
And shred majestically to your heart

[Chorus]
I try but I can waste one million chances
Before you're gone, before I get your name
Keep dreamin' 'cause I'm the only one awake here
You're always gone, always slip away

[Instrumental Break]

[Chorus]
I try but I can waste one million chances
Before you're gone, before I get your name
Keep dreamin' 'cause I'm the only one awake here
You're always gone, always slip away
I try but I can waste one million chances
Before you're gone, before I get your name
Keep dreamin' 'cause I'm the only one awake here
You're always gone, always slip away[Verse 1]
Going out we hope to lose ourselves
Then get found in unlikely places
A little presumption's all you need
To end up empty
Who really says they hope they'll meet the one
For the first time at a bar drinking early?
Easy enough to say ""Hey man, I'm done""
And never hear them say

[Chorus]
Oh honey, if you stay, hey, hey
We go all the way
But how am I supposed to know, oh, no
When to let the feelings show?
Honey, if you stay, hey, hey
We take it all the way
And no one really knows, oh, no
When to let the feelings show, oh-ho, oh-ho
Oh-oh, oh-oh

[Verse 2]
We get discouraged by the pointlessness
And we're pretty quick to judge things pointless
There's what I want and what I need
And the latter takes a while to see
It doesn't matter how often or how old
It starts with an awkward beginning
I believe that what I've learned has worth
And what I choose to do means something

[Chorus]
So honey, if you stay, hey, hey
We go all the way
But how am I supposed to know, oh, no
When to let the feelings show?
Honey, if you stay, hey, hey
We take it all the way
'Cause no one really knows, oh, no
When to let the feelings show, oh-ho, oh-ho

[Bridge]
Crowds and the noise receding
Down to just you and me, yeah
We could do anything you want

[Chorus]
So honey, if you stay, hey, hey
We go all the way
But how am I supposed to know, oh, no
When to let the feelings show?
Honey, if you stay, hey, hey
We take it all the way
Whoever really knows, oh, no
When to let the feelings show? Oh-oh, oh-oh, oh

[Outro]
When to let the feelings show, oh-oh, oh-oh
When to let the feelings show, oh-oh, oh-oh
When to let the feelings show, oh-oh, oh-oh
When to let the feelings show, oh-oh, oh-oh
When to let the feelings show, oh-oh, oh-oh
When to let the feelings show, oh-oh, oh-oh[Verse 1]
When I find myself awake
I'll put my thoughts down on the page
Half-asleep, I'll make a list
Then read back all my greatest hits
Should meditate, should work out more
Should read until my brain gets sore
Meet someone, go far away
Try being socially less strange

[Chorus]
That's how a diamond grows, yeah
Give yourself the right chance over time
Don't believe them if they try to sell you something quicker, yeah

[Verse 2]
I cut at least half of my friends
But no one noticed or mentioned
I thought at last I'd breathe easy
But then I thought a lot of things
Hey new year, hey new you
You left so much low-hanging fruit
You're in the ring for the title fight
With only montage training time

[Chorus]
That's how a diamond grows, yeah
Give yourself the right chance over time
Don't believe them if they try to sell you something quicker, yeah
That's how a diamond grows, yeah
Reach as far as you can then hold tight
Don't believe them if they try to tell you something different, yeah

[Bridge]
They say a diamond grows with time
I believe it, 'cause I've seen it with my eyes
Well, there's a guaranteed parade of broken promises
Did you expect some kind of miracle
You do what you can do, that's all, all, all

[Chorus]
That's how a diamond grows, yeah
Give yourself the right chance over time
Don't believe them if they try to sell you something quicker, yeah
That's how a diamond grows with time
Don't believe them if they try to tell you something different[Verse 1]
Love ain't never been your friend
Love never gonna hear what you're demanding
Love ain't some magical thing
Love never gonna be the way you're dreaming

[Chorus]
It's gonna seem so far
It's gonna feel so hard
Until you want the work more than the reward
Do you want the work more than the reward?

[Verse 2]
Love ain't some magical thing
Love never gonna be the way you're dreaming

[Chorus]
It's gonna seem so far
It's gonna feel so hard
Until you want the work more than the reward
Until you stop asking ""Oh, what is it all for?""
Do you want the work more than the reward?

[Instrumental Bridge]

[Chorus]
It's gonna seem so far
It's gonna feel so hard
Until you want the work more than the reward
Until you stop asking ""Oh, what is it all for?""
Do you want the work more than the reward?[Verse 1]
Will they tell you what you missed?
All you have traded in
And it hits
You're not that different
The truth is no one did
Half of it

[Chorus]
Think all this time what you're giving
Stay in my heart or waste another life
Start another life

[Verse 2]
From a fever to a kiss
Such frivolousness
They exist
It's all significant
No one straight line to live
Recommit

[Chorus]
Think all this time what you're giving
Stay in my heart or waste another life
Start another life
Think all this time what you're giving
Stay in my heart or waste another life
Start another life

[Bridge]
Always commanding
A way out
Is coming

[Chorus]
Think all this time what you're giving
Stay in my heart or waste another life
Start another life
Think all this time what you're giving
Stay in my heart or waste another life
Start another life

[Outro]
Or waste another life
Start another life[Verse 1]
There's no clarity in front of me
Only degrees of hating
Obscenity, there's no charity
Some don't deserve to make it
You'll blame and fight each other
For just a slice of plunder
Too down and tired to wonder
Whose foot you're crawling under

[Chorus]
Oh-oh-oh-oh (Oh-oh-oh-oh)
Ah-ah, oh-oh-oh (Ah-ah, oh-oh-oh)
You're on your own
You're on your own

[Verse 2]
Read carefully, can't possibly
A threat to future earnings
Suspiciously, through editing
The facts are disappearing
With discipline and message
You'll take awkward possession
Of nothing you really wanted
Welcome, congratulations

[Chorus]
Oh-oh, you're on
You're on your own

[Verse 3]
There's no clarity in front me
Only degrees of hating
Obscenity, there's no charity
Some don't deserve to make it
You'll blame and fight each other
For just a slice of plunder
Too down and tired to wonder
Whose foot you're crawling under

[Refrain]
Oh-oh-oh-oh
Ah-ah, oh-oh-oh
Oh-oh-oh-oh
Ah-ah, oh-oh-oh
Ah-ah, oh-oh-oh-oh",2019-10-26,6.9
Eartheater,Trinity,"<a class=""genre-list__link"" href=""/reviews/albums/?genre=experimental"">Experimental</a>","Alexandra Drewchin titled the fourth full-length release under her Eartheater alias as a nod to the three states matter can commonly take: solid, liquid, and gas. It’s a fitting conceit to drape over her work, which tends to melt from concrete pop forms into ominous miasma and back again. Trinity, a mixtape made in collaboration with half a dozen New York producers including AceMo and Tony Seltzer, crystallizes Drewchin’s experimental slant into a full set of dance music built around her signature oblique vocals. Without sacrificing Eartheater’s compelling strangeness, Drewchin has assembled the project’s most accessible and triumphant offering to date.Dance beats skittered here and there on past Eartheater records, but more often than not they worked as texturing tools against the rest of Drewchin’s nebulous compositions. On “Curtains,” from 2018’s IRISIRI, a rave beat pulsed against sheets of placid harp, as though leaking into an orchestral musician’s practice session from an upstairs apartment. Trinity hews closer to the traditional dynamics of dance music: Its songs take beats for their backbones, even if those beats often lurch uneasily through dizzying arrangements. For every element on Trinity that’s easy to grasp, another repels and confuses the ear. On “High Tide” and “Supersoaker,” glassy synthesizer riffs echo late-’90s radio trance, while the blunt bass drums on “Pearl Diver” recall avant-garde strains of contemporary hip-hop.Throughout the record, Drewchin’s voice closes off the easy access points of dance pop, which in its most mainstream incarnations tends to flood listeners with dopamine at every chorus. Layered and thinned with reverb, her singing remains slippery, her lyrics often tricky to pin down. Ostensibly these are love songs, and yet their streaks of affection drip out in confusing, contradictory ways, in double negatives and barely intelligible whispers. “I don’t wanna regret/Something I didn’t do/With you,” Drewchin sings on “Runoff”—a statement that starts out with what sounds like hesitation, which turns into abandon by the end of the sentence.Because her presence is often elusive, it tends to beckon the ear to sink deeper into each song, to grasp at a salient phrase or an especially tuneful melody. Drewchin makes it easy to get lost in her ambiguous sound worlds, which don’t seem to have clear boundaries but always appear to be deepening in volume.Trinity’s tensions build toward its final song and thesis statement, “Solid Liquid Gas.” Rather than end the record on an uncertain, sour note, Drewchin and producer Hara Kiri give it the sendoff it deserves—an unleashed, cathartic dance track where Drewchin’s voice clears away the mist that had clung to it. “Don’t make me wait!” she demands, her voice dense and sharp over a frothing synthesizer arpeggio. If latent desire percolates throughout Trinity, voiced in hushed tones, then “Solid Liquid Gas” gives Drewchin the chance to finally let her wanting rush out of her. It’s a blissful release that bursts past the cerebral parameters of her prior work and into new territory—the kind of song that jolts through the whole body, thrilling as it goes.","I can see you
I don't feel [?]
[?]

I think it's my first summer
This is real [?]
This is [?]
I've been waiting for you
To come out of the darkness

[?]

I think it's my first summer
This is real [?]
This is [?]
I've been waiting for you
To come out of the darkness
[?]
This is [?]
I've been waiting for you
To come out of the darkness

Leisurely waiting
Leisurely waiting
Leisurely waiting

I think it's my first summer
This is real [?]
This is [?]
I've been waiting for you
To come out of the darkness
[?]
This is [?]
I've been waiting for you
To come out of the darknessWater can put out flames
But nothing can stop this day
I feel a high tide in my eyes
Brimming at the sight of you
I feel a high tide in my chest
Ready to flood this house
Gush down the hallway
Crashing through the windowpane
Wash the pain away
Water can put out flames
But nothing can stop this day
The tide is high
Tide is high
Tide is high
Tide is high

My condensation
Every drop in me gushes in your direction

I feel a hurricane in my arms
Brimming at the sight of you
I feel a hurricane in my chest
Ready to absorb this mess
Gush down the hallway
Crashing through the windowpane
Wash the pain away
Water can put out flames
But nothing can stop this day
The tide is high
Tide is high
Tide is high
Tide is high(Supersoaker)

Don't make me wait
You got me [?]
You know I got that supersoaker
Meet me in the deep side of the pool [?]
[?] snorkel
[?]

Flash floods don't lie
You know I'm not faking it
Flash floods don't lie
You know I'm not faking

Flash floods don't lie
You know I'm not faking it
Flash floods don't lie
Gush don't lie

Flash floods don't lie
You know I'm not faking it
Flash floods don't lie
Gush don't lie

Don't make me wait
You got me [?]
You know I got that supersoaker
Meet me in the deep side of the pool [?]
[?] snorkel
[?]

Flash floods don't lie
You know I'm not faking it
Flash floods don't lie
You know I'm not faking

Flash floods don't lie
You know I'm not faking it
Flash floods don't lie
You know I'm not faking

Don't make me wait
You make me [?]
You know I got that supersoakerSay something
Spill the milk, on myself
That [?]
[?]
I know you want it
In this apartment
[?] drain
[?] faucet
Get it all made [?]
Get it all made [?]

[?] a cup
[?] runnin' through
I can hardly drink enough water to keep up with my physical [?]
No promises
You don't have to bludgeon your affection
[?] something this way
It's dangerous, hydroplane
Slide

Say something
Spill the milk, on myself
That [?]
[?]
I know you want it
In this apartment
[?] drain
[?] faucet
Get it all made [?]
Get it all made [?]

Trying to kill this plane
I'm hoping that I'm never gonna see you again
[?]
So say something [?]

Say something
Spill the milk, on myself
That [?]
[?]
I know you want it
In this apartment
[?] drain
[?] faucet
Get it all made [?]
Get it all made [?]Spit in my mouth
I’ve been surviving on saliva

Lick my tears
But bite my tongue
A plus and a minus
Keeps me on

Don't suck me into comfort
Or claustrophobia
Don't suck me into something numb
Let's just make out
Suck some blood
No promises
They are dripping off of me

I'm standing in a lake
Crystal clear as day reflected in your face
I reach in
And break the skin
Cunning linguistically

Spit in my mouth
I’ve been surviving on salivaI need a pearl, pearl diver
Someone who's not phased by the crashing waves
I need a pearl, pearl diver
Someone who dives really deep

Pearl diver
Find the pearl

Like a cunning linguist
Finding the words
You find the pearl
You find the pearl

I need a pearl, pearl diver
Someone who's not phased by the crashing waves
I need a pearl, pearl diver
Someone who dives really deep

Pearl diver
Find the pearl
All the way
Inside the girl
It's inside me
It's inside her

Pearl diver
Find the pearl
All the way
Inside the girl
It's inside me
It's inside her

UnderwaterI'm just gonna stay 'til the tough love [?]
Gonna stay 'til the solid [?]
Rain, rain
Come down

I know that [?]
I'm gonna stay 'til the ice goes
Gonna stay
I'm just gonna stay 'til the tough love
Gonna stay 'til the solid [?]
Rain, rain
Come down

Hold me
Like the polar ice
Look out now
Don't get saved [?]

I'm coming back through the globe
Coming back through the globe
I'm coming back through the globe

Hold me
Like the polar ice
Look out now
Don't get saved [?]

I'm coming back through the globe
Coming back through the globe
I'm coming back through the globe

I'm just gonna stay 'til the tough love [?]
Gonna stay 'til the solid [?]
Rain, rain
Come down

I know that [?]
I'm gonna stay 'til the ice goes

Gonna stayYou know that I'm the kind
I don't wanna regret
Something that I didn't do
[?] something else
Something that I didn't do
With you, with you

I'm about to pass out
I'm about to [?]

You know that I'm the kind
I don't wanna regret
Something that I didn't do
Rather than something I
Something that I didn't do
With you, with you
I don't wanna be brave
Something I didn't do
With you

[?] my eyes
Like vanilla sky [?]
It's been a long time
Been a long time
I woke up like [?]
I come to the [?]
[?] coming down
[?]
Sailin through the deep blue

You know that I'm the kind
I don't wanna regret
Something that I didn't do
[?]
Something that I didn't do
With you, with you
I don't wanna be brave
Something that I didn't do
With youEven [?] stays behind
My eyes, I can't deny

Even [?] stays behind
My eyes, I can't deny

Someone [?] has come to see
The final [?]

You fell right through the fontanel
[?]
Rippling shivers run through the [?]
You fell right through the fontanel
Rippling shivers run through the [?]
You fell right through the fontanel

Even [?] stays behind
My eyes, I
Can't deny

You fell right through the fontanel
[?][?]
Melting [?]
[?] reflecting [?]
In my humid air
On my [?]
[?]

Inhale me, heavy breathing
I'm the wind and pain
I was made by the sight of you
Have me evaporating
[?] to the heavens
I'll be waiting
In [?] condensating
I'm evaporating
[?]
Don't make me wait
Don't make me wait
You make me waste it

[?]
Melting [?]
[?] reflecting [?]
In my humid air
On my [?]
[?]

[?]

Inhale me, heavy breathing
I'm the wind and pain
I was made by the sight of you
Have me evaporating
[?] to the heavens
I'll be waiting
In [?] condensating
I'm evaporating
[?]
Don't make me wait
Don't make me wait
You make me waste it",2019-10-26,7.3
