date, album, artist, review_content, album_lyrics, score
King Princess,Cheap Queen,"<a class=""genre-list__link"" href=""/reviews/albums/?genre=pop"">Pop/R&amp;B</a>","By now, Mikaela Straus’ artistic predicament has become uncannily familiar: A young unknown with a fresh, infectious sound releases a song that catches fire. Streams rack up, fame arrives overnight; the pressure’s on to articulate an artistic identity, cook up a debut album, and make good on the promise of that first hit, fast—all while contending with the gaze of several million curious onlookers. If Straus, who’s better known as King Princess, wanted to compare notes on the ups and downs of a viral breakout, she could do so with a fairly spectacular peer group that includes Maggie Rogers, Billie Eilish, and Clairo.Straus’ story has an added layer of complexity. Last year, the 20-year-old singer-songwriter rose up on the shoulders of her song “1950,” a sticky, Harry Styles-cosigned debut that took inspiration from classic queer literature and opened with a nod to her sexual orientation: “I hate it when dudes try to chase me.” On its heels came “Talia,” a bit of liquor-wet, post-breakup revelry directed to a conspicuously female subject, and the self-explanatory single “Pussy Is God.” Within months, King Princess was not just a burgeoning pop phenom, but a burgeoning queer idol.In the historically sanitized landscape of pop music, queer expression is undeniably radical, particularly how Straus does it—by naming and gendering her desire in a way that, not long ago, few dared to. And if Straus is fazed by the burden of representation, she doesn’t show it. Her debut album—that first true test of her artistry—is titled Cheap Queen, borrowing a term from drag culture, and on its cover, she appears with her face done up in drag queen glam, down to the painted-on beauty mark. The title track, she says, is a tribute to her squad, all cheap queens in their own right. (Straus, whose father runs Brooklyn’s Mission Sound studio, inherited a leg up in the industry, so it’s a bit cheeky of her to make a personal brand of scrappiness—but then, cheekiness is part of her brand, too.) Like any good pop song, “Cheap Queen” strikes a balance between specificity and relatability. It shouts out its community without wading into identity politics, instead cultivating, through its inclusive warmth and effortless swagger, a stoner-pop appeal likely to resonate with anyone who’s ever stayed up drinking and smoking with pals.Thematically, though, “Cheap Queen”—originally one of the album’s sharp, economical interludes, until Straus’ team persuaded her to expand it—stands apart. On the whole, the album is more concerned with lovers than with friends. Sequenced as a chronological narrative, Cheap Queen loosely follows a fraught renegotiation of space between exes; the particulars aren’t quite so interesting as the emotions they draw out. Straus has noted her eagerness to “write about getting my heart smashed,” and she repeatedly delivers on the drama of that declaration. “Homegirl,” a schmaltzy, vibraphone-embellished ballad, tracks the triangulation of glances between Straus and the boys who are eyeing the same woman at a party—the kind of gathering where close quarters reveal vast emotional distance. The gulf between Straus and her love interest widens as she considers forgotten possessions unlikely to be reclaimed (“Isabel’s Moment”) and nervously awaits a text unlikely to arrive (“Watching My Phone”).The latter song’s clincher is an admission of inadequacy: “I can’t be the million girls you’re going to meet.” The meekness is gutting; its narrator is barely recognizable as the same person who earlier claimed to be “getting too cocky, since everyone wants me,” who wrote off her ex with a sweetly condescending, “You’re probably just a fan now, babe.” But embracing opposing energies is the King Princess way. She is confident and vulnerable, cool and earnest. As her chosen moniker suggests, she’s masculine and feminine, swaggering and soft, posing for Playboy as both cheerleader and jock. She’s posing for Playboy, a bastion of the male gaze that her widely broadcasted sexuality belies.In particular, Cheap Queen plays on a tension between old and new. Straus and her Gen-Z peers grew up listening to Drake, Beyoncé, and Taylor Swift, but Straus’ industry-adjacent upbringing also exposed her to ’70s rock bands including Led Zeppelin and T. Rex. Like Styles, who helped precipitate her fame, she seems eager to cut her modern pop sensibility with doses of historicism. On Cheap Queen, the drum pads and Auto-Tune harmonics that defined her first singles are still part of the mix, but the computer isn’t her primary tool. There’s a hint of Janis Joplin when Straus layers in blues guitar and organ or teases the occasional snarl out of her otherwise silky voice. Latter-day rock prophet Father John Misty drops by to handle drums on “Ain’t Together,” a crisp, handsome tune with Beatles-esque eccentricity in its (digitally approximated) Mellotron fills and densely layered backing vocals.Still, Straus is a distinctly contemporary creator, versed in samples and pitch-shifts and interludes—songs as short as post-digital attention spans—that house some of her most intriguing musical ideas. To the extent that viral success is explicable, it seems sensible that hers continues to hold. As Cheap Queen makes plain, she’s not an ingénue with one great idea—she has a few dozen of them, informed by sources spanning decades and genres. There are moments when she slips up—“Watching My Phone,” with its lugubrious strings and wistful choral embellishments, feels particularly overworked—and she isn’t breaking ground in pop by disregarding its supposed borders. But where post-genre stream-baiters pull their numbers by anesthetizing distinctive sounds, King Princess pulls hers by playing up their contrasts.Buy: Rough Trade(Pitchfork may earn a commission from purchases made through affiliate links on our site.)","[Verse 1]
Nobody told me
To sit down and shut up
And take this shit slowly
I'm so bad with attention
So my good intentions
Get bad when you hold me

[Chorus]
I get too tough on myself
Sitting alone, making fun of myself

[Verse 2]
You want that young love
Like passing me notes, hon'
That shit that you dream of
I'm just sitting at home
Smoking joints like it's my job
'Cause that's what my dream was

[Chorus]
I get too tough on myself
Sitting alone, making fun of myself
And is it so wrong to just want someone else?
(I was thinking you and I could get together)
(I was thinking maybe you could do me better)
And is it so wrong to just want someone else?
(I was thinking you and I could get together)
(I was thinking maybe you could do me better)

[Bridge]
Tough on myself
I get too
I get too tough on myself
I get too tough on mys—

[Chorus]
I get too tough on myself
(I was thinking you and I could get together)
(I was thinking maybe you could do me better)
Sitting alone making fun of myself
(I was thinking you and I could get together)
(I was thinking maybe you could do me better)
And is it so wrong to just want someone else?
(I was thinking you and I could get together)
(I was thinking maybe you could do me better)
And is it so wrong to just want someone else?
(I was thinking you and I could get together)
(I was thinking maybe you could do me better)You say you want me back
And I don't usually entertain such useless phrases, baby
I thought I had the facts
And I don't usually entertain such useless phrases, baby[Verse 1]
(Cheap queen)
I've been alright
I've just been doing the same shit I've always liked (Smiling for the audience)
Like smoking and movies and homies who bring me wine
I've been going out too much (Queen)
And talking 'bout myself too much (Oh, smiling for the audience)

[Chorus]
I can be good sometimes
I'm a cheap queen
I can be what you like
And I can be bad sometimes
I'm a real queen
I can make grown men cry
I can be good sometimes
I'm a cheap queen
I can be what you like
And I can be bad sometimes
I'm a real queen
I can make grown men cry

[Verse 2]
Makin' my name (Queen)
All of my girls get up early and stay out late (Queen)
They drive all the way to the west side to see my face (How did I do it?)
That's good love (Good love, good love)
And I ain't no big baller when it's fake friends you're callin'

[Chorus]
I can be good sometimes
I'm a cheap queen
I can be what you like
And I can be bad sometimes
I'm a real queen
I can make grown men cry
I can be good sometimes
I'm a cheap queen
I can be what you like
And I can be bad sometimes
I'm a real queen
I can make grown men cry

[Bridge]
I'm gettin' too cocky since everyone wants me (Queen)
It's harder to be myself (Queen, queen)
Do-do-do-do-do-do-do-do (Smiling)
But I see you love me (Queen)
It's better than money to know that you call me out (Cheap queen)
But when the money's out
I can make grown men cry

[Chorus]
I can be good sometimes
I'm a cheap queen
I can be what you like
And I can be bad sometimes
I'm a real queen
I can make grown men cry
I can be good sometimes
I'm a cheap queen
I can be what you like
And I can be bad sometimes
I'm a real queen
I can make grown men cry

[Outro]
Queen
Do-do-do-do-do-do-do-do (Smiling for the audience)
Queen
Cheap queen, queen
Do-do-do-do-do-do-do-do (Smiling for the audience)
How did I do it?
Queen[Verse 1]
I know you're with me
And I'd love to see someone else call you
And all this in between
You think it's hard for me to tell you're fallin'
Oh, we're fallin'

[Pre-Chorus]
And bein' chill, bein' chill with you
Oh, it kills, I ain't chill at all, at all

[Chorus]
We say ""I love you,"" but we ain't together
Do you think labels make it taste much better?
Darlin', do you think that if I talk enough
I will make you wanna be mine?
We ain't together

[Verse 2]
Cut off all these hoes (Ah)
Baby, you don't gotta worry 'bout nothing (Ah)
'Cause everybody knows (Ah)
That you and I got that somethin' (Ah)

[Pre-Chorus]
And bein' chill, bein' chill with you (Ah)
Oh, it kills, I ain't chill at all, at all

[Chorus]
We say ""I love you,"" but we ain't together
Do you think labels make it taste much better?
Darlin', do you think that if I talk enough
I will make you wanna be mine?
We ain't together

[Bridge]
And I can't watch this fall apart

[Chorus]
We say ""I love you,"" but we ain't together
Do you think labels make it taste much better?
Darlin', do you think that if I talk enough
I will make you wanna be mine?
'Til you don't say you and I ain't together, babe
Ain't together
Ain't together[Intro]
Do you wanna see me cry for you?
Do you wanna see me cry for you?
Do you wanna see me cry for you?

[Chorus]
I think it's cuter when I dance now
I think I'm nicer to my friends now
(Do you wanna see me cry for you?)
I think I'm working through the stress now
I wanna put a million songs out
(Do you wanna see me cry for you?)
I keep my money in my hands now
And I feel better with my heart out
(Do you wanna see me cry for you?)
And you're probably just a fan now
Took a minute, but I found out
(Do you wanna see me cry for you?)
I think it's cuter when I
I think it's cuter when I
(Do you wanna see me cry for you?)

[Chorus]
It's cuter when I dance now
I think I'm nicer to my friends now
I think I'm working through the stress now
I wanna put a million songs out
I keep my money in my hands now
And I feel better with my heart out
And you're probably just a fan now, babe
Took a minute, but I found out
Took a minute, but I found out
Oh[Verse 1]
They stare when you walk in the room
Like they're looking at Heaven
Oh, you know that those boys will do
More than just look if you let them

[Pre-Chorus]
And I don't wanna be like them with you
But you still look at me like him

[Chorus]
And you taste like danger, but I feel so safe in your arms
And I like the way that you talk slow
Spelling my name with your tongue, so
You don't have to say it
We're friends at the party, I'll give you my body at home

[Verse 2]
Oh, I stare when you walk in the room
Like I'm scared to forget you
If you're thinking that I'm gonna
Act like those boys, I would never

[Pre-Chorus]
But I don't wanna be like them with you
But you still look at me like him

[Chorus]
And you taste like danger, but I feel so safe in your arms
And I like the way that you talk, slow
Spelling my name with your tongue, so
You don't have to say it
We're friends at the party, I'll give you my body at home[Verse 1]
You call when you want it
Everyone wants something from your soul on the molly
Someone's friend is talking like they know, oh, you’re on it
I just want to be your pretty girl when you want it

[Chorus]
'Cause I can only think about you
And what it's like to walk around you
And why they like to talk about you
’Cause I can only think about you

[Verse 2]
You know what you want
It's only 'bout the money and control
Can't step off it, someone else will cop it
Like it's gold, you're a prophet
Someone's gonna profit
Don't you know I just want it, uh

[Chorus]
I can only think about you
And what it’s like to walk around you
And why they like to talk about you
’Cause I can only think about you
'Cause I can only think about you
And what it’s like to walk around you
And why they like to talk about you
'Cause I can only think about you

[Bridge]
Oh, no apologies, twisting your word and your prophecy
Oh, and honestly, it's the price of the prodigy you wanna be
Oh, no apologies, twisting your words and your prophecy
Oh, and honestly

[Chorus]
I can only think about you
And what it's like to walk around you
And why they like to talk about you
’Cause I can only think about you
'Cause I can only think about you
And what it's like to walk around you
And why they like to talk about you
'Cause I can only think about you

[Outro]
Oh, think about you
(It's the price of the prodigy you wanna be)
Thinking about you
(Do-do-do)
Think about
(It's the price of the prodigy you wanna be)
Oh, thinking about you, oh
(It's the price of the prodigy you wanna be)
'Cause I can only think about you
(It's the price of the prodigy you wanna be)
Oh, I can only think about you, yeah[Verse: King Princes]
Maybe it's over, maybe it's not
But hope is a thing that you find when you're sober
And your clothes are still in my drawers
Like you're haunting my home
I'd be amazed if you walked through those doors
Like ""Hey, how's it going?""
But you haven't come over
Maybe I'm dumb
But you can't choose your love like a phone number
And I'm still trying to draw all the lines
Through my friends and my lovers
It ain't clear how we feel
When we spend all this time with each other

[Outro: King Princess & Tobias Jesso Jr.]
Is it how it's gonna be?
Is it how it's gonna be?
Is it how it's gonna be?
Is it how it's gonna be?
Is it how it's gonna be?
Is it how it's gonna be?
How it's gonna be[Verse 1]
I don't ever trust nobody
No, I don’t ever trust, but I trust you
Ain't that great?
And I'm still dumb when no one’s watching
I bet you're cool when no one's watching you
I guess it's fate

[Chorus]
And she said, ""Meet me at the party""
But I don't know nobody
And she said I'm getting there
They treat you like a ticket
But I just wanna kick it
And honey, I'll take you there
Oh, when everyone starts calling for me
Oh, I only pick up for you

[Verse 2]
Well, I don't ever trust nobody
And they think I’m cute and kinda funny
Oh, I guess that’s fair
And I get dumb when you start talking
And one more night and I might fall for you
Oh, I'm there

[Chorus]
And she said, ""Meet me at the party""
But I don’t know nobody
And she said I'm getting there
They treat you like a ticket
But I just wanna kick it
And honey, I'll take you there
Oh, when everyone starts calling for me
Oh, I only pick up for you

[Bridge]
Watching me slip over words, it kinda hurts
For what it's worth
I just wanna be with you, babe
I don’t know nobody
But she said I'm getting there (Oh)

[Outro]
And she said, ""Meet me at the party""
But I don't know nobody, baby
Watching me slip over words, it kinda hurts
For what it's worth
I just wanna be with you (They treat you like a ticket)
But I just wanna kick it
Watching me slip over words, it kinda hurts
For what it's worth
I just wanna be with you, yeah
I just wanna be with you
I don't know nobody
But she said I'm getting there (Oh)
I just wanna be with you
I just wanna be with you, babe
I just wanna be with you, babe
I just wanna be with you
I just wanna be with you[Verse 1]
And I know you
Destroy the things you love to save yourself
And I'm passing through your life
And I know you
Can't bear to see me go, but make me leave
In the middle of the night

[Pre-Chorus]
(Maybe it will change, but)
You ain't all I've ever wanted in a package
And your independence throws me off my balance
And I'm alone

[Chorus]
Watching my phone
Thinking 'bout you, baby
Watching my phone
Thinking 'bout you

[Verse 2]
And I know I
Can't be the million girls you're gonna meet
And I think that's alright
I apologize
For holding you so tight you couldn't breathe
And thinking you'd be fine

[Pre-Chorus]
(Maybe it will change, but)
Oh, you ain't all I've ever wanted in a package
And your independence throws me off my balance
And I'm alone

[Chorus]
Watching my phone
Thinking 'bout you, baby
Watching my phone
Thinking 'bout you

[Bridge]
Watching my phone
Thinking 'bout you, baby
Watching my phone
(Maybe it will change, but)

[Outro]
Watching my phone
Thinking 'bout you, baby
Watching my phone
Thinking 'bout you
Thinking 'bout you
Thinking 'bout you
(Maybe it will change, but)[Verse 1]
Heard you saw my tricks
I know I gave you superstar
And from the barricade
I've heard you move your hips
But you should probably learn your place
'Cause this isn't it, baby

[Chorus]
You destroyed my heart
Now I want somebody good
'Cause you lost the part
Now I want somebody good

[Verse 2]
I could get you back (That's cute)
And we could probably reenact
But I'm a better fag, and you're an amateur
(She seems so lost)
And it's cute you wanna be my friend
It would never work, baby

[Chorus]
You destroyed my heart
Now I want somebody good
'Cause you lost the part
Now I want somebody, want somebody good

[Bridge]
What you saw, what you caused
And you seem so sad like it's all my fault
But it's not 'cause you're gone
It's the best I had, but I'm moving on
Like a pro (She seems so lost), it's my job
You can break my trust, I just build my funds
And it's time, give me up
And you seem so sad, but it's not my fault

[Chorus]
'Cause you, you broke my heart
Now I want somebody good
'Cause you lost the part
Now I want somebody good
Destroyed my heart
Now I want somebody good (She seems so nice)
'Cause you lost the part
Now I want somebody good (She seems so nice)
Destroyed my heart
Now I want somebody good (She seems so nice)
'Cause you lost the part
Now I want somebody good

[Outro]
She seems so lost
She seems so lost
She seems so lost[Verse 1]
I need you to search my clothing
Pat me down and feel the molding
'Cause underneath this table feels so good to me
And I need you to be my motor
And run me 'til I can't go further
'Cause every turn you take is just exciting me

[Chorus]
And ain't I the best you had?
And I'll let you throw it down, hit the back
Tell me I need respect
And you know that I'm around, I'm your pet
Ain't I the best you had?
And I'll let you throw it down, hit the back
Tell me you need respect
'Cause you know that I'm around, I'm your pet

[Verse 2]
Well, I'm a star, but you're an icon
A dirty girl with lots of passion
Staring at my fingers while I talk to you
And I don't care if you degrade me
'Cause after all, you are my safety
And everything you touch just feels like yours to me

[Chorus]
Ain't I the best you had?
And I'll let you throw it down, hit the back
Tell me you need respect
'Cause you know that I'm around, I'm your pet
Ain't I the best you had?

[Bridge]
(Ain't I the best you've ever had?)
It's really been nice to meet ya, babe
(Take my heart and hit the back)
(Ain't I the best you had?)
I think that I really need ya, baby
(Ain't I the best you've ever had?)
I think that I really need ya, baby
(Take my heart and hit the back)

[Chorus]
Ain't I the best you had?
And I'll let you throw it down, hit the back
Tell me you need respect
'Cause you know that I'm around, I'm your pet

[Outro]
Ain't I the best you had?
(Ain't I the best you've ever had?)
Ain't I the best you had?
(Take my heart and hit the back)
Ain't I the best you had?
(Ain't I the best you've ever had?)
(Take my heart and hit the back)[Verse 1]
If this is love
I want my money back
'Cause I could use the check
To spend it on a better heart
To wear upon my sleeve
And it might take a sec
My world's become a mess
I'm second-guessing all the things
I used to wanna be

[Chorus]
So if you think it's love, it is
And if you think it's trust, it is
And if you think it's love, it is
It is

[Verse 2]
If you want trust
I'll need my conscience back
She got so out of whack
My broken back has carried all
The weight I thought I'd need
And it might take a sec
My world's been changing fast
The normal things I never thought
I'd miss are obsolete

[Chorus]
So if you think it's love, it is
And if you think it's trust, it is
And if you think it's love, it is
It is

[Outro]
And if you think it's love, it is
And if you think it's trust, it is
And if you think it's love, it is
And if you think it's trust, it is
And if you think it's love, it is
And if you think it's trust, it is
And if you think it's love, it is
And if you think it's trust, it is
And if you think it's love, it is
And if you think it's trust, it is
And if you think it's love, it is
And if you think it's trust, it is (Yeah)",2019-10-28,7.4
Donato Dozzy,12H,"<a class=""genre-list__link"" href=""/reviews/albums/?genre=electronic"">Electronic</a>","For over 15 years, Italian producer Donato Dozzy has masterfully ranged from tech house to trance to straight techno. But at his core, he is a minimalist, gleefully finding the strangest, most archaic element to zoom in on, turning any mole hill into Monte Bianco. His beatific ambient techno collaboration with fellow producer Neel, 2012’s Voices From the Lake, took as its starting point a single incident, a live set to be performed at Japan’s infamous Labyrinth festival. And in the past few years, Dozzy’s zoomed in even further, relentlessly exploring every imaginable facet of the mouth harp, the 303, and Anna Caragnano’s singing voice across full-length albums.So it makes a certain kind of sense that a single object lies at the heart of his latest epic, 12H: the Armando Trovajoli - Music Bridge in Rome. While plans for the structure date back to 1929, the bridge was only completed in 2008. It’s the lone steel bridge that runs over the River Tiber into the historic center of Rome. This release on Lorenzo Senni’s Presto!? label is culled from material that Dozzy recorded and assembled for a sound installation designed for 24 speakers that ran the length of the colonnade of the bridge. 12H clocks in at almost 100 minutes, at times evoking the immersive, exquisitely detailed ambience of Voices from the Lake, but without the same breathtaking vistas and sumptuous peaks.The set opens with Dozzy in resplendent, shimmering ambient mode, all body-dissolving washes, tingling small bells, electronics that mimic the sound of frogs at night, and slow-moving arpeggios. Other elements pop up, like running water and clattering wind chimes, before “12H.3” introduces a gentle pulse and quivering synth line, only to have it splash back into gurgly water sounds and electronics.A magnificent highlight comes on “12H.5,” which could be a leftover from Sintetizzatrice, his collaboration with Caragnano. The track painstakingly layers her gossamer breaths, building a sigh into a skyscraper.  As that piece dissipates, the first smattering of percussion finally enters, nearly 45 minutes into the album, the hand drums pinging about the stereo field like a gentle tribute to E2-E4. Usually when drums enter Dozzy’s mixes, they elevate the proceedings to an unimaginable new high. Here, they don’t really add much in the way of emotion or release.The throbs of “12H.8” soon get submerged by field recordings of insects rustling in the distance. The metallic thrums and acid stabs that punctuate “12H.9” are texturally intriguing, though they too soon fall to the wayside. We’re left to wonder what it might have sounded like had Dozzy pushed a few elements further or higher (as when Dozzy dropped a masterful techno rework of “12H.5” as a single earlier this year), rather than let the strictures of minimalism tamp everything down. The sounds of bridge traffic dovetail nicely with 12H’s kosmische-esque closing track, but like most urban congestion problems, it just takes far too long to get there.",,2019-10-28,6.8
